{
  "$schema": "../snapshot.schema.json",
  "schemaVersion": 1,
  "capturedAt": "2026-09-04T06:06:54Z",
  "captureMethod": "user_initiated_signed_in_medium_ui_read_only",
  "profile": "@singhaditya21_89007",
  "scopes": {
    "currentMonth": {"label": "September 2026", "presentations": 3, "views": 8, "reads": 0},
    "audienceLifetime": {"followers": 3, "emailSubscribers": 2},
    "storyLifetime": [
      {"story": "Model Routing Is Capital Allocation", "slug": "model-routing-is-capital-allocation", "presentations": 3, "views": 1, "reads": 0, "readRatio": 0.0},
      {"story": "Your Multi-Agent System Is a Distributed System", "slug": "your-multi-agent-system-is-a-distributed-system", "presentations": 4, "views": 3, "reads": 0, "readRatio": 0.0},
      {"story": "Human Approval Is a Queueing System", "slug": "human-approval-is-a-queueing-system", "presentations": 5, "views": 0, "reads": 0, "readRatio": 0.0},
      {"story": "Every AI Agent Action Needs a Receipt", "slug": "every-ai-agent-action-needs-a-receipt", "presentations": 5, "views": 9, "reads": 0, "readRatio": 0.0},
      {"story": "Your AI Agent's Memory Is a Database, Not a Prompt", "slug": "your-ai-agents-memory-is-a-database-not-a-prompt", "presentations": 3, "views": 1, "reads": 0, "readRatio": 0.0},
      {"story": "A $2.4M Account Is Escalating. Should the AI Agent Act?", "slug": "a-2-4m-account-is-escalating", "presentations": 6, "views": 0, "reads": 0, "readRatio": 0.0},
      {"story": "AI Agent Identity Is Not Enough", "slug": "ai-agent-identity-is-not-enough", "presentations": 12, "views": 11, "reads": 2, "readRatio": 0.1818},
      {"story": "What an Agent Actually Costs", "slug": "what-an-agent-actually-costs", "presentations": 7, "views": 4, "reads": 1, "readRatio": 0.25},
      {"story": "The Enterprise Agent Control Tower: A Production Architecture", "slug": "enterprise-agent-control-tower", "presentations": 9, "views": 8, "reads": 4, "readRatio": 0.5},
      {"story": "How to Build an Agentic CRM: A Reference Architecture", "slug": "agentic-crm-reference-architecture", "presentations": 13, "views": 10, "reads": 5, "readRatio": 0.5},
      {"story": "Why Traditional CRM Will Die Without Agentic AI", "slug": "traditional-crm-agentic-ai", "presentations": 8, "views": 6, "reads": 5, "readRatio": 0.8333}
    ]
  },
  "notes": [
    "September account totals are a partial-month snapshot covering September 1 through September 4, 2026 UTC and must not be compared directly with a complete month.",
    "Story rows are lifetime totals for all eleven stories published on Medium at capture time; scheduled stories are intentionally excluded until publication.",
    "Read ratio is derived as reads divided by views from the captured counts and is zero when views are zero.",
    "Views divided by presentations is not Medium feed clickthrough because views may originate outside trackable Medium presentation surfaces.",
    "Medium displayed monthly metrics as updated hourly, story lifetime metrics as updated daily, and Audience metrics as updated daily.",
    "No Medium account mutation was performed during this read-only capture."
  ]
}
